{
    "actor":{"mbox":"mailto:tom@example.com", "name":"andy", "objectType":"Agent"},
    "verb":{"id":"http://tom.com/verb", "display":{"en":"hi"}},
    "object": {"id":"http://tom.com/obj"},
    "attachments": [
        {
            "usageType": "http://adlnet.gov/expapi/attachments/test",
            "display": { "en-US": "Test" },
            "description": { "en-US": "A test" },
            "contentType": "application/octet-stream",
            "length": 4235,
            "sha2": "672fa5fa658017f1b72d65036f13379c6ab05d4ab3b6664908d8acf0b6a0c634",
            "fileUrl": "http://server/path/file.txt"
        }
    ]
}
