{
    "id":"cc8937ed-3151-1659-b377-38ed4fc96c90",
    "actor":{"mbox":"mailto:tom@example.com", "name":"andy", "objectType":"Agent"},
    "verb":{"id":"http://tom.com/verb", "display":{"en":"hi"}},
    "object": {"id":"fox://tomcom/obj"},
    "version":"1.0.3",
    "timestamp":"2017-03-23T21:14:21.690Z",
    "stored":"1971-01-27T22:44:32.458999Z"
}
