{
    "id":"f5070c3a-cd39-4dc3-8dd2-4ad3b511c407",
    "actor":{"mbox":"mailto:tom@example.com", "name":"andy", "objectType":"Agent"},
    "verb":{"id":"http://tom.com/verb", "display":{"en":"hi"}},
    "object": {"id":"http://tom.com/obj"},
    "context": {
        "registration": "bc5ca8ec-b130-4d8e-a092-3af748cf7a54",
        "revision":"4",
        "platform":"yep",
        "language":"en",
        "contextActivities": {},
        "extensions": {}
    }
}
